//UC1:

mysql> CREATE DATABASE addressbook_service;
Query OK, 1 row affected (0.01 sec)

mysql> show databases;
+---------------------+
| Database            |
+---------------------+
| addressbook_service |
| information_schema  |
| mysql               |
| payroll_service     |
| performance_schema  |
| sakila              |
| sampledatabase1     |
| sampledatabase2     |
| sys                 |
| world               |
+---------------------+
10 rows in set (0.02 sec)
------------------------------------------------------------------------------------------------------------------------------------------
//UC2:

mysql> CREATE TABLE address_book
    -> (
    -> first_name varchar(150),
    -> last_name varchar(150),
    -> address varchar(150),
    -> city varchar(50),
    -> state varchar(50),
    -> zip varchar(6),
    -> phone_number varchar(10),
    -> email varchar(50)
    -> );
Query OK, 0 rows affected (0.04 sec)
------------------------------------------------------------------------------------------------------------------------------------------
//UC3:

mysql> INSERT INTO address_book VALUES('Prem', 'Kumbhar', 'Kolhapur', 'Kolhapur', 'Maharastra', '416001', '9099999990', 'premk@gmail.com');
Query OK, 1 row affected (0.02 sec)
-------------------------------------------------------------------------------------------------------------------------------------------
//UC4:

mysql> UPDATE address_book set address = 'Pune', city = 'Pune' WHERE first_name = 'Prem';
Query OK, 1 row affected (0.01 sec)
Rows matched: 1  Changed: 1  Warnings: 0

mysql> SELECT * from address_book;
+------------+-----------+---------+------+------------+--------+--------------+-----------------+
| first_name | last_name | address | city | state      | zip    | phone_number | email           |
+------------+-----------+---------+------+------------+--------+--------------+-----------------+
| Prem       | Kumbhar   | Pune    | Pune | Maharastra | 416001 | 9099999990   | premk@gmail.com |
+------------+-----------+---------+------+------------+--------+--------------+-----------------+
1 row in set (0.00 sec)
------------------------------------------------------------------------------------------------------------------------------------------
//UC5:

//"Before deleting the data:"
+------------+-----------+----------+----------+------------+--------+--------------+----------------------+
| first_name | last_name | address  | city     | state      | zip    | phone_number | email                |
+------------+-----------+----------+----------+------------+--------+--------------+----------------------+
| Prem       | Kumbhar   | Pune     | Pune     | Maharastra | 416001 | 9099999990   | premk@gmail.com      |
| Prathmesh  | Kumbhar   | Kolhapur | Kolhapur | Maharastra | 416001 | 9099999988   | prathmeshk@gmail.com |
+------------+-----------+----------+----------+------------+--------+--------------+----------------------+
2 rows in set (0.00 sec)

//"After deleting the data:"

mysql> DELETE FROM address_book WHERE first_name = 'Prathmesh';
Query OK, 1 row affected (0.01 sec)

mysql> SELECT * from address_book;
+------------+-----------+---------+------+------------+--------+--------------+-----------------+
| first_name | last_name | address | city | state      | zip    | phone_number | email           |
+------------+-----------+---------+------+------------+--------+--------------+-----------------+
| Prem       | Kumbhar   | Pune    | Pune | Maharastra | 416001 | 9099999990   | premk@gmail.com |
+------------+-----------+---------+------+------------+--------+--------------+-----------------+
1 row in set (0.00 sec)
------------------------------------------------------------------------------------------------------------------------------------------
//UC6:

mysql> SELECT * FROM address_book WHERE city = 'Kolhapur' or state = 'Maharastra';
+------------+-----------+----------+----------+------------+--------+--------------+----------------------+
| first_name | last_name | address  | city     | state      | zip    | phone_number | email                |
+------------+-----------+----------+----------+------------+--------+--------------+----------------------+
| Prem       | Kumbhar   | Pune     | Pune     | Maharastra | 416001 | 9099999990   | premk@gmail.com      |
| Prathmesh  | Kumbhar   | Kolhapur | Kolhapur | Maharastra | 416001 | 9099999988   | prathmeshk@gmail.com |
+------------+-----------+----------+----------+------------+--------+--------------+----------------------+
2 rows in set (0.00 sec)
------------------------------------------------------------------------------------------------------------------------------------------
//UC7:

mysql> SELECT COUNT(*) FROM address_book WHERE city = 'Pune' or state = 'Maharastra';
+----------+
| COUNT(*) |
+----------+
|        2 |
+----------+
1 row in set (0.01 sec)
-----------------------------------------------------------------------------------------------------------------------------------------
//UC8:

mysql> SELECT * FROM address_book WHERE city = 'Pune' ORDER BY first_name;
+------------+-----------+---------+------+-------------+--------+--------------+-------------------+
| first_name | last_name | address | city | state       | zip    | phone_number | email             |
+------------+-----------+---------+------+-------------+--------+--------------+-------------------+
| Prem       | Kumbhar   | Pune    | Pune | Maharastra  | 416001 | 9099999990   | premk@gmail.com   |
| Rohit      | Kumbhar   | pune    | pune | maharashtra | 123456 | 9090909077   | Rohit@gmail.com   |
| Sushant    | Patil     | pune    | pune | maharashtra | 123456 | 9090909099   | Sushant@gmail.com |
+------------+-----------+---------+------+-------------+--------+--------------+-------------------+
3 rows in set (0.01 sec)
------------------------------------------------------------------------------------------------------------------------------------------
//UC9:

mysql> ALTER TABLE address_book ADD type varchar(50) AFTER email;
Query OK, 0 rows affected (0.06 sec)
Records: 0  Duplicates: 0  Warnings: 0

mysql> UPDATE address_book SET type = 'Brother' WHERE first_name = 'Prathmesh';
Query OK, 1 row affected (0.01 sec)
Rows matched: 1  Changed: 1  Warnings: 0

mysql> UPDATE address_book SET type = 'Friend' WHERE first_name = 'Sushant';
Query OK, 1 row affected (0.01 sec)
Rows matched: 1  Changed: 1  Warnings: 0

mysql> UPDATE address_book SET type = 'Friend' WHERE first_name = 'Rohit';
Query OK, 1 row affected (0.00 sec)
Rows matched: 1  Changed: 1  Warnings: 0

mysql> SELECT * from address_book;
+------------+-----------+----------+----------+-------------+--------+--------------+----------------------+---------+
| first_name | last_name | address  | city     | state       | zip    | phone_number | email                | type    |
+------------+-----------+----------+----------+-------------+--------+--------------+----------------------+---------+
| Prem       | Kumbhar   | Pune     | Pune     | Maharastra  | 416001 | 9099999990   | premk@gmail.com      | NULL    |
| Prathmesh  | Kumbhar   | Kolhapur | Kolhapur | Maharastra  | 416001 | 9099999988   | prathmeshk@gmail.com | Brother |
| Sushant    | Patil     | pune     | pune     | maharashtra | 123456 | 9090909099   | Sushant@gmail.com    | Friend  |
| Rohit      | Kumbhar   | pune     | pune     | maharashtra | 123456 | 9090909077   | Rohit@gmail.com      | Friend  |
+------------+-----------+----------+----------+-------------+--------+--------------+----------------------+---------+
4 rows in set (0.00 sec)
-----------------------------------------------------------------------------------------------------------------------------------------
//UC10:

mysql> SELECT COUNT(*) FROM address_book GROUP BY type;
+----------+
| COUNT(*) |
+----------+
|        1 |
|        1 |
|        2 |
+----------+
3 rows in set (0.04 sec)
-----------------------------------------------------------------------------------------------------------------------------------------
//UC11:

mysql> INSERT INTO address_book VALUES('Ranjit', 'Patil', 'Pune', 'Pune', 'Maharastra', '123456', '9090909066', 'ranjit@gmail.com', 'Family');
Query OK, 1 row affected (0.01 sec)

mysql> INSERT INTO address_book VALUES('Ranjit', 'Patil', 'Pune', 'Pune', 'Maharastra', '123456', '9090909066', 'ranjit@gmail.com', 'Friend');
Query OK, 1 row affected (0.01 sec)


mysql> SELECT * FROM address_book;
+------------+-----------+----------+----------+-------------+--------+--------------+----------------------+---------+
| first_name | last_name | address  | city     | state       | zip    | phone_number | email                | type    |
+------------+-----------+----------+----------+-------------+--------+--------------+----------------------+---------+
| Prem       | Kumbhar   | Pune     | Pune     | Maharastra  | 416001 | 9099999990   | premk@gmail.com      | NULL    |
| Prathmesh  | Kumbhar   | Kolhapur | Kolhapur | Maharastra  | 416001 | 9099999988   | prathmeshk@gmail.com | Brother |
| Sushant    | Patil     | pune     | pune     | maharashtra | 123456 | 9090909099   | Sushant@gmail.com    | Friend  |
| Rohit      | Kumbhar   | pune     | pune     | maharashtra | 123456 | 9090909077   | Rohit@gmail.com      | Friend  |
| Ranjit     | Patil     | Pune     | Pune     | Maharastra  | 123456 | 9090909066   | ranjit@gmail.com     | Family  |
| Ranjit     | Patil     | Pune     | Pune     | Maharastra  | 123456 | 9090909066   | ranjit@gmail.com     | Friend  |
+------------+-----------+----------+----------+-------------+--------+--------------+----------------------+---------+
6 rows in set (0.00 sec)

------------------------------------------------------------------------------------------------------------------------------------------
