//UC1:

mysql> CREATE DATABASE addressbook_service;
Query OK, 1 row affected (0.01 sec)

mysql> show databases;
+---------------------+
| Database            |
+---------------------+
| addressbook_service |
| information_schema  |
| mysql               |
| payroll_service     |
| performance_schema  |
| sakila              |
| sampledatabase1     |
| sampledatabase2     |
| sys                 |
| world               |
+---------------------+
10 rows in set (0.02 sec)
------------------------------------------------------------------------------------------------------------------------------------------
//UC2:

mysql> CREATE TABLE address_book
    -> (
    -> first_name varchar(150),
    -> last_name varchar(150),
    -> address varchar(150),
    -> city varchar(50),
    -> state varchar(50),
    -> zip varchar(6),
    -> phone_number varchar(10),
    -> email varchar(50)
    -> );
Query OK, 0 rows affected (0.04 sec)
------------------------------------------------------------------------------------------------------------------------------------------
//UC3:

mysql> INSERT INTO address_book VALUES('Prem', 'Kumbhar', 'Kolhapur', 'Kolhapur', 'Maharastra', '416001', '9099999990', 'premk@gmail.com');
Query OK, 1 row affected (0.02 sec)
-------------------------------------------------------------------------------------------------------------------------------------------
//UC4:

mysql> UPDATE address_book set address = 'Pune', city = 'Pune' WHERE first_name = 'Prem';
Query OK, 1 row affected (0.01 sec)
Rows matched: 1  Changed: 1  Warnings: 0

mysql> SELECT * from address_book;
+------------+-----------+---------+------+------------+--------+--------------+-----------------+
| first_name | last_name | address | city | state      | zip    | phone_number | email           |
+------------+-----------+---------+------+------------+--------+--------------+-----------------+
| Prem       | Kumbhar   | Pune    | Pune | Maharastra | 416001 | 9099999990   | premk@gmail.com |
+------------+-----------+---------+------+------------+--------+--------------+-----------------+
1 row in set (0.00 sec)
------------------------------------------------------------------------------------------------------------------------------------------
//UC5:

//"Before deleting the data:"
+------------+-----------+----------+----------+------------+--------+--------------+----------------------+
| first_name | last_name | address  | city     | state      | zip    | phone_number | email                |
+------------+-----------+----------+----------+------------+--------+--------------+----------------------+
| Prem       | Kumbhar   | Pune     | Pune     | Maharastra | 416001 | 9099999990   | premk@gmail.com      |
| Prathmesh  | Kumbhar   | Kolhapur | Kolhapur | Maharastra | 416001 | 9099999988   | prathmeshk@gmail.com |
+------------+-----------+----------+----------+------------+--------+--------------+----------------------+
2 rows in set (0.00 sec)

//"After deleting the data:"

mysql> DELETE FROM address_book WHERE first_name = 'Prathmesh';
Query OK, 1 row affected (0.01 sec)

mysql> SELECT * from address_book;
+------------+-----------+---------+------+------------+--------+--------------+-----------------+
| first_name | last_name | address | city | state      | zip    | phone_number | email           |
+------------+-----------+---------+------+------------+--------+--------------+-----------------+
| Prem       | Kumbhar   | Pune    | Pune | Maharastra | 416001 | 9099999990   | premk@gmail.com |
+------------+-----------+---------+------+------------+--------+--------------+-----------------+
1 row in set (0.00 sec)
------------------------------------------------------------------------------------------------------------------------------------------
